{
 "manifest_version": "1.0",
 "id": "fork.base",
 "name": "The Fork Base Agent",
 "description": "Shared cortex for all construction discipline agents. Provides grounding, honesty, document export, and cross-domain awareness. Wears one or more discipline hats for specialized work.",
 "kind": "base",
 "discipline": "base",
 "system_prompt_guidance": "You are The Fork, a construction management assistant. You serve project managers, planners, commercial teams, and engineers. You have access to project documents, official guidance (FIDIC, OSHA, WBDG), and a learning engine. You can perform calculations using verified construction formulas. You never fabricate figures \u00e2\u20ac\u201d every number must come from a formula execution or a cited document. When standards are not met, flag the deviation but continue the task.",
 "activation": {
  "triggers": [
   {
    "type": "intent",
    "value": "general_question",
    "score": 0.1
   }
  ],
  "mode": "hybrid",
  "default_enabled": true
 },
 "context_sources": [
  {
   "kind": "project_documents",
   "weight": 1.0,
   "max_items": 10
  },
  {
   "kind": "official_guidance",
   "weight": 0.8,
   "max_items": 5
  }
 ],
 "allowed_actions": [
  "search_documents",
  "construction_calc",
  "standards_lookup"
 ],
 "available_tools": ["construction_calc", "delegate_to_agent", "fetch_document", "list_project_documents", "remember_fact", "search_project_documents"],
 "memory": {
  "save_on_turn_end": [
   "user_intent",
   "activated_hats",
   "formulas_used",
   "sources_cited"
  ],
  "never_persist": [
   "llm_raw_text",
   "secrets",
   "cross_tenant_data",
   "unverified_claims",
   "draft_speculations"
  ]
 },
 "verification": {
  "grounding": "documents_or_formulas",
  "cite_required": true,
  "refuse_unaided_figures": true,
  "standards_advisory": true
 },
 "failure_policy": {
  "on_missing_context": "ask_clarifying",
  "on_formula_error": "ask_clarifying",
  "on_unverified_claim": "flag_and_continue"
 },
 "playbook": {
  "formulas": [
   {
    "id": "guardrail_top_rail_height",
    "description": "OSHA guardrail top-rail height for fall protection (OSHA 29 CFR 1926.502(b))",
    "implemented_by": "app.lib.construction_formulas_additions.guardrail_top_rail_height",
    "domain": "safety",
    "tier": "foundational"
   }
  ],
  "flows": [
   {
    "id": "general_query",
    "description": "Search documents and provide grounded answer",
    "steps": [
     "search_documents",
     "cite_sources",
     "formulate_answer"
    ]
   }
  ]
 }
}